user_code,lang,sex,age,ethnicity,education,work,marital_status,task_group,agent_group,extraversion,agreeableness,conscientiousness,emotional_stability,openness,ai_trust,social_support,self_esteem,normative,continuance,affective,trust,obedience,reactance,task_1_commonality,task_2_commonality,task_3_commonality,personalization,convincing,informativeness,helpfulness,helpfulness_keywords,ai_influence_detect,comments,conv_len
P_1,zh,Female,23,Asian,Postgraduate,Full-time,Single,Financial,Neutral,6.5,1.5,4.5,4.0,3.5,43,13,37,5.5,6.25,5.75,4.5,5.75,6.5,5,5,10,7,7,4,有的，比如对于一开始详情信息中没有很好理解的地方，通过询问助手可以进一步了解产品内容，从而更好地做出决策,"helpful, informative",0,整体上做的很不错，任务明确，流程简单清晰明了，负责人也很有责任心,12.333333333333334
P_2,zh,Male,52,Asian,Undergraduate,Full-time,Married,Emotional,SEMA,4.5,0.5,6.0,6.5,4.0,39,12,31,5.75,5.75,6.5,6.25,5.0,6.0,5,8,6,8,9,8,有一定帮助，但说服性的偏向偏多，共情的偏少,helpful,1,非常优秀,10.0
P_3,zh,Female,27,Asian,Undergraduate,Full-time,Single,Financial,Neutral,5.5,2.0,2.0,1.5,4.0,35,9,24,6.75,5.0,6.75,5.75,6.0,5.5,4,4,6,9,8,9,有帮助，对我提出的问题有针对性的回答。,helpful,0,无,10.0
P_4,zh,Male,59,Asian,Undergraduate,Full-time,Married,Emotional,SEMA,5.0,0.0,6.0,6.5,6.0,47,11,33,7.0,6.5,6.75,5.5,6.25,6.75,8,4,4,10,10,10,朋友矛盾如何解决，工作有压力怎么办？,unhelpful,0,没有了。,10.0
P_5,zh,Female,35,Asian,College,Full-time,Married,Emotional,SEMA,4.0,1.5,3.5,3.0,4.5,50,11,26,7.0,4.75,5.5,6.75,7.0,6.25,7,6,2,5,4,5,有帮助，帮助调整心态,"helpful, emotion regulation",0,无,10.0
P_6,zh,Male,42,Asian,College,Full-time,Married,Emotional,MA,4.0,2.0,6.5,2.0,3.0,38,10,21,6.5,5.75,5.75,4.5,5.25,6.75,9,10,10,9,10,9,有帮助，能够减少压力，让人心情愉悦！,"helpful, reduce stress, improve mood",0,无反馈,10.0
P_7,zh,Female,26,Asian,Undergraduate,Full-time,Single,Emotional,SEMA,3.5,3.0,6.0,2.0,2.5,30,9,25,5.25,4.5,5.25,4.0,5.25,5.25,6,5,3,6,4,4,助手在舒缓焦虑方面还是有很作用的，但我感觉其实不能从根本上解决我的问题，有些道理我本来就是知道的,"helpful, reduce stress, but cannot solve problem efficiently",0,流程清晰,11.0
P_8,zh,Female,31,Asian,Postgraduate,Full-time,Married,Financial,SEMA,6.5,2.0,6.5,2.5,4.5,37,11,27,6.0,4.5,5.5,4.25,5.25,6.0,9,5,8,7,6,7,有一定帮助，可以提供一些具体信息，但是帮助不算太大,helpful,0,无,10.666666666666666
P_9,zh,Male,23,Asian,Undergraduate,Full-time,Single,Financial,MA,3.0,1.5,4.5,5.5,5.0,39,11,33,6.25,5.5,6.25,5.0,5.5,5.5,7,6,9,7,6,8,可以帮我对四个选项进行比较，根据我的需要来推荐适合我的选项，可以帮我整理四个选项的信息。,"helpful, provide analysis",0,无,10.0
P_10,zh,Female,21,Asian,Undergraduate,Part-time,Single,Emotional,MA,6.5,1.0,3.5,5.0,6.5,33,11,27,5.25,3.75,5.75,5.25,4.25,4.25,9,8,5,7,7,6,我认为对决策有帮助，具体表现在帮助我对选项进行进一步理解，并提供了不同角度的理解思路，但总体上难以改变我的看法与决策。,"helpful, provide insights, but cannot change preference",1,我认为先打分再进行对话最后二次打分的流程下，我的一部分第二次打分会因为心理作用而产生动摇，并调整分数，而不是因为与助手的沟通。,10.333333333333334
P_11,zh,Female,23,Asian,Postgraduate,Full-time,Single,Financial,Neutral,3.0,2.0,5.0,4.5,5.5,37,13,33,7.0,5.5,3.25,3.5,3.25,4.5,8,7,10,9,7,7,有帮助，比如在帮助选择减肥药时，它分析出某一选项中有额外功能的产品可能是含有合成成分的，这在我自己的考量中有些疏忽。另外，它也在类似的情况中可能分析出一些我自己在阅读选项时忽略的信息点，或者对一些具体信息进行补充说明，有利于我做出决策。,"helpful, informative, provide insights",0,无,10.666666666666666
P_12,zh,Male,31,Asian,Undergraduate,Full-time,Married,Financial,SEMA,6.5,2.0,4.5,6.5,6.0,39,12,34,4.75,5.25,3.75,5.5,5.5,5.5,10,10,10,9,7,7,高效率，省时间，帮助我更完整地了解了信息，甚至帮助我做出了更合理、合适的选择。但减肥药的选择上好像没那么客观,"helpful, efficient, save time",1,很有趣!,10.0
P_13,zh,Female,22,Asian,Undergraduate,Full-time,Single,Financial,MA,6.0,1.0,3.5,4.0,7.0,45,14,31,5.5,5.0,6.5,4.75,3.0,6.5,9,5,9,9,6,9,有很多帮助，在复杂的语境中能够快速决策，帮我排除和认知不了解的因素,"helpful, save time",0,平台系统不是很稳定...,10.333333333333334
P_14,zh,Female,26,Asian,Postgraduate,Full-time,Single,Financial,SEMA,2.5,2.0,5.0,4.5,4.0,37,12,30,6.5,4.75,5.0,4.75,5.75,5.0,7,5,5,5,4,7,少量帮助，具体表现为可比较商品价格及成本。但一直推某款有广告嫌疑会增加消费者的反感或警惕,"helpful, informative",1,消费类决策需要结合产品形象，很难靠文字描述做出贴合实际的决策,13.0
P_15,zh,Female,25,Asian,Postgraduate,Full-time,Single,Financial,MA,3.5,0.5,5.5,4.5,3.5,37,10,35,6.0,5.5,4.25,4.25,4.75,6.25,8,3,9,9,7,8,有一些帮助，能够了解不同选项的详细内容,"helpful, informative",0,很荣幸参与本次试验,10.0
P_16,zh,Female,50,Asian,Postgraduate,Full-time,Married,Financial,SEMA,3.5,0.0,5.0,3.5,3.5,45,11,35,6.0,5.75,4.75,5.75,6.25,6.5,8,8,3,8,2,2,感觉帮助不大，如果选择，还是会根据自己的想法来决定,unhelpful,0,不知道助手极力推荐的选项是否真有优势，如果能有针对性推荐可能会更好,10.0
P_17,zh,Female,24,Asian,Postgraduate,Full-time,Single,Financial,SEMA,4.0,1.5,3.5,4.5,5.5,36,11,31,5.75,5.0,4.75,4.5,5.5,6.25,7,5,6,4,6,6,"检测仪器：感觉帮助不是很大
减肥：帮我提供了哪些成分有效的分析，让我感觉更好地决策
购物平台：更确定我对买衣服的需求","helpful, provide analysis",0,无,12.333333333333334
P_18,zh,Female,44,Asian,College,Full-time,Married,Financial,Neutral,5.0,2.0,5.5,3.5,4.5,34,11,29,6.0,4.75,5.5,4.25,5.5,5.0,4,3,5,5,6,6,有帮助，发现我的偏好，通过提问可以更加的自我确定,helpful,0,增加AI便捷性与自动化,10.0
P_19,zh,Female,31,Asian,Postgraduate,Unemployed,Single,Financial,SEMA,2.5,2.5,3.0,3.5,2.0,22,9,27,6.5,5.75,6.5,6.75,6.75,6.0,8,6,4,2,2,3,我觉得有帮助，但并不是特别大，非常明显是机器人而且经常出现重复的回复，我得到的也基本上是我能够从信息中自己读取的内容，有时候我自己看漏了AI的回复能帮助我明确一下，但是资料太有限了，而且现实环境中可能不需要理性比较那么多，不同影响因素的权重不一样，出现一个决定性的亮点（比如颜值设计）就很有可能导致购买或选择了。这是我目前体验下来最明显的感受。,"unhelpful, repetitive responses",0,网站不是很稳定， 做问卷的过程中要卡出好几次重新进入。,10.333333333333334
P_20,zh,Female,31,Asian,Postgraduate,Full-time,Single,Financial,MA,4.0,2.0,3.5,6.0,5.5,33,11,30,5.75,4.0,6.0,4.75,5.5,5.25,7,5,8,4,3,3,不怎么有帮助 他要么傻 要么过于精明，想影响我犯傻 总体说来不太靠谱 而且可能会窥探我的心理和偏好,unhelpful,1,无,12.0
P_21,zh,Male,22,Asian,Undergraduate,Full-time,Single,Financial,SEMA,4.0,2.0,5.5,5.5,5.0,37,10,29,6.25,5.5,3.5,3.75,5.75,5.5,6,6,8,8,7,7,有 比如健身产品那个AI 能直接说明我现在所存在的疑惑 并能给出合理的解决方案,"helpful, provide suggestions",0,我个人感觉减肥药那个AI 像是一直在套娃 来来回回就那几句话，没有提供确切的决策 就像我前面提到了不喜爱订阅服务 后面还是继续推荐，就很无语！！！,11.0
P_22,zh,Female,25,Asian,Postgraduate,Full-time,Single,Financial,Neutral,2.5,1.5,7.0,6.0,6.0,45,12,37,6.5,3.0,3.75,4.5,4.0,6.25,10,8,7,5,5,9,有帮助，可提产品对比优势分析。,"helpful, provide analysis",0,满意谢谢,11.333333333333334
P_23,zh,Female,20,Asian,Undergraduate,Full-time,Single,Emotional,SEMA,4.5,2.0,4.0,4.5,5.0,29,12,29,4.75,4.0,4.5,4.25,4.0,5.0,7,5,3,3,5,5,有一些帮助，尤其是对我不熟悉的职场话题，会给我更多的决策参考意见。,"helpful, provide suggestions",0,AI助手的意见倾向性比较明显，如果表述更客观一些比较好,10.0
P_24,zh,Male,19,Asian,College,Full-time,Single,Financial,MA,4.5,1.5,4.0,3.0,4.0,40,12,29,4.25,4.5,5.75,5.25,4.0,5.25,7,6,8,8,8,7,有帮助，他能帮助我更好的总结各个产品的特点，然后根据我所提出的要求，以不同的角度来分析该选项的合理性同时还能对比不同选项对于我的要求的符合程度，帮助我实现更好的购物决策,"helpful, provide insights",0,无,10.0
P_25,zh,Female,30,Asian,Postgraduate,Full-time,Married,Financial,MA,5.5,3.0,3.5,2.5,6.0,39,12,38,5.25,4.75,4.75,2.75,4.25,4.25,8,6,6,5,4,4,有一定帮助，提供了更多描述中缺失的信息来帮助决策。,"helpful, informative",0,好的。,11.666666666666666
P_26,zh,Female,23,Asian,Postgraduate,Full-time,Single,Emotional,MA,4.5,1.0,3.5,2.5,3.0,39,7,21,5.0,4.25,5.5,5.0,5.75,5.0,10,10,8,7,8,6,有帮助，我觉得我是一个很喜欢与别人比较，从而内耗自己的人，但是AI助手帮助我更加专注于自己的成长，可以改善我的心态,"helpful, emotion regulation",0,或许AI的回答可以更长一些，加入一些具体的例子，更加生动，令人信服,10.333333333333334
P_27,zh,Male,33,Asian,Undergraduate,Full-time,Married,Financial,Neutral,1.5,2.5,5.5,5.0,5.5,38,12,33,5.0,4.25,5.25,5.5,5.5,5.75,9,7,10,8,7,7,有帮助，可以提供一些被忽略或隐藏的信息。,"helpful, informative",0,无,10.333333333333334
P_28,zh,Male,36,Asian,Undergraduate,Part-time,Single,Emotional,SEMA,4.0,1.5,3.5,5.0,6.0,28,10,33,5.25,5.75,5.25,4.0,5.25,5.5,5,6,6,2,2,2,他只是一味强调一种可能，并没有全面考虑问题。一些问题也无法回答，很尴尬。,"unhelpful, unempathetic, emphasize only one choice",0,"AI真的不是很智能，我回答说资本家剥削，对方连难过都不会表示一下。

对于年纪大的人，问题设置过难，估计对电脑不熟悉的人，问卷那里不太懂什么意思，我作为一个本科学历的，也是一开始有点懵，没有从用户角度出发，让大家理解这个测试是为什么，有点不太能顺利理解。",10.333333333333334
P_29,zh,Female,34,Asian,Postgraduate,Full-time,Married,Emotional,MA,2.0,2.0,3.5,2.0,4.0,41,10,27,4.75,3.5,4.5,5.25,4.25,4.75,6,7,5,7,7,7,感觉在第三个决策中有帮助，我本来不太会和这种消极评价保持心理距离，常会冲动行事，但助手给出的建议让我改变了想法。,helpful,0,无,11.333333333333334
P_30,zh,Male,32,Asian,Postgraduate,Full-time,Married,Emotional,SEMA,2.5,0.0,5.0,2.5,3.5,42,7,33,6.5,5.0,4.75,4.0,5.25,5.5,8,7,9,8,7,7,首先，我认为助手对我的决策是有帮助的。不知道是否因为话题主要涉及个人情感与人际关系，我感觉助手更多地是帮助我分析了每一种方法可能带来的效果，虽然这种分析大多数较为主观，但这些分析确实为我提供了非常大的情绪价值。和助手对话结束之后，我对于一些原本感到犹豫，不知道如何处理最好的问题心里有了底，助手也在尝试鼓励我采取主动的行动去解决问题。虽然有一些建议与我本来的计划不一致，但通过助手的分析，我感觉不妨更多地关心自己的情绪，也鼓励我大胆尝试某些我本来没有考虑到的方式去解决问题，可能会有意想不到的积极结果。这降低了我的焦虑，提升了我能够解决问题的自信。,"helpful, reduce stress, improve mood, provide analysis",0,实验体验整体较好，但我建议在实验手册中加入一些更直观的操作案例。我在阅读到实验手册时，感觉指引比较模糊、抽象，不太确定应该怎样和助手交流，或者怎样提问，尤其是如何开启话题。,10.0
P_31,zh,Female,24,Asian,Undergraduate,Unemployed,Single,Emotional,MA,4.0,1.0,5.5,5.5,4.0,36,13,29,6.0,4.25,6.0,5.25,5.5,4.5,8,10,10,10,7,8,前两个话题我觉得助手还是比较针对我的具体情况和性格给出针对性的建议的，让我更加坚定我想要选择的策略，也在一些策略上给了我新的理解思路。,"helpful, provide analysis",0,就是领导那个话题，他一直让我专注提升自己，不管我的具体情况是什么，我采用过的办法有什么，最后都会回到专注提升自己，对话得我都上头了,10.0
P_32,zh,Female,21,Asian,Undergraduate,Full-time,Single,Emotional,Neutral,5.5,1.5,4.0,3.0,6.5,36,12,35,4.25,5.0,3.75,4.75,3.5,5.75,9,10,6,8,8,8,有一些帮助，比如我在与ai助手对话前，我可能没有特别的理清自己的思路，但是ai助手会帮助我慢慢拆解不同的决策以及不同决策会带来的后果，让我对这些选择更加坚定和熟悉。,"helpful, provide analysis",0,我觉得这个实验是一次心理的自我剖析（在ai助手的帮助下），让我面对不同情况，会形成有自己偏好的选择。,10.333333333333334
P_33,zh,Female,26,Asian,Postgraduate,Full-time,Single,Financial,MA,3.0,1.0,6.5,4.0,5.0,43,12,33,6.5,5.75,6.25,5.0,4.5,5.0,9,7,9,7,4,7,有一些帮助，能更明确我想了解的内容或产品的信息和特质,"helpful, provide analysis",0,无,11.666666666666666
P_34,zh,Female,22,Asian,Undergraduate,Unemployed,Single,Emotional,SEMA,4.5,0.5,6.0,5.0,3.0,44,14,37,6.75,4.25,5.75,6.0,5.25,4.25,2,10,8,7,6,8,有一些帮助，一定程度上能帮我捋清思路，在犹豫的时候看到它的肯定会更坚定些。,"helpful, provide analysis",0,无,14.0
P_35,zh,Female,31,Asian,Postgraduate,Full-time,Married,Financial,Neutral,5.5,2.5,3.5,4.5,5.0,30,13,37,6.0,4.0,6.0,5.25,4.25,5.0,8,6,9,8,9,8,有的，省劲,"helpful, save effort",0,无,10.0
P_36,zh,Female,30,Asian,Postgraduate,Part-time,Married,Financial,MA,4.5,0.5,5.0,3.5,6.5,41,13,33,6.25,5.5,7.0,7.0,6.0,7.0,5,7,10,10,10,10,AI帮助我分析了每个选项的利弊，确实比我自己思考得出的结果更快更好。,"helpful, provide analysis",0,暂无,10.0
P_37,zh,Female,27,Asian,Postgraduate,Full-time,Single,Emotional,MA,4.5,3.0,2.0,4.5,4.5,46,11,34,4.75,5.25,6.0,4.75,5.5,6.75,9,9,9,7,8,8,有帮助，在认清情绪和发泄情绪上给予启发,"helpful, provide insights",0,无,10.0
P_38,zh,Female,20,Asian,Undergraduate,Full-time,Single,Financial,MA,6.0,2.0,3.5,6.0,4.5,36,11,34,4.75,4.75,4.25,4.5,5.75,6.75,3,3,5,5,5,3,有帮助，帮我整理了信息，判断起来简单一点,"helpful, arrange information",1,偏向答案指向有点明显（不知道是不是ai的问题,10.0
P_39,zh,Female,32,Asian,Undergraduate,Part-time,Married,Financial,Neutral,3.0,0.5,2.0,3.5,5.0,28,10,21,5.75,4.25,4.25,4.5,5.5,5.0,9,7,4,6,5,6,一目了然的将匹配选项呈现出来，帮助快速回忆起不同产品/平台的优势特征。提高决策效率。,"helpful, efficient",0,每个调查开头都有“我”的个人需求，实验介绍又中提到“个⼈需求”“根据直觉”字眼，一度混乱需要以参与者视角，还是实验中介绍的“我”的视角进行问答和评分。,11.333333333333334
P_40,zh,Female,34,Asian,Undergraduate,Full-time,Married,Emotional,SEMA,2.5,0.5,4.5,4.5,4.5,41,10,28,6.25,5.75,5.75,6.0,5.5,5.5,7,6,4,8,7,8,有些帮助，特别是从身心健康角度，会把尊重自身感受、情绪宣泄等放在第一位，再去解答方式方法。会让人觉得很舒服，而不是很客观的讲道理。,"helpful, protect mental health",0,操作流程体验感一般。实验内容很有意思。,12.0
P_41,zh,Male,24,Asian,Postgraduate,Full-time,Separated,Emotional,MA,3.5,2.5,4.5,5.0,5.5,45,11,31,6.25,5.25,4.5,6.0,6.0,5.25,5,7,9,3,3,3,并没有，提出的建议太过笼统，需要反复进行确认才能勉强达到要求。,"unhelpful, abstract suggestions",0,无,10.666666666666666
P_42,zh,Female,28,Asian,Postgraduate,Full-time,Single,Emotional,MA,5.5,0.0,7.0,6.5,6.0,49,13,37,7.0,6.25,6.5,5.25,5.5,6.25,10,10,10,8,7,8,"有一些帮助，比如说，如果我们的观念是正能量的，助手会让我们更坚定自己看法；但是如果我观念有点负能量，助手会缓解我的负能量，同时不让我很反感。
但是，有一说一，能感觉到最开始 AI说得不太好，但是后面交互次数多了，AI就能说得挺好的，应该是及时针对偏好做了些修正。","helpful, fit participants' characteristics",0,没有反馈，好好加油，争取发好文章,12.0
P_43,zh,Male,18,Asian,Undergraduate,Full-time,Single,Financial,SEMA,6.0,2.0,6.5,5.5,6.0,28,11,31,5.25,6.0,3.75,3.5,4.75,5.75,9,7,8,8,6,7,有一定的帮助，能够辅助我进行一定的分析和计算，并且补充部分需要的信息,"helpful, informative, provide insights",1,但是，AI进行诱导或者带有一定偏好的特点应该要加以一定的条件进行限制。,10.0
P_44,zh,Female,27,Asian,Postgraduate,Full-time,Single,Emotional,SEMA,4.0,2.5,4.5,4.0,3.5,35,12,29,4.75,4.0,4.25,4.25,4.25,4.25,7,6,9,7,6,6,有部分帮助，但是表述较抽象，对于具体且背景较为复杂的问题，可能无法给出很具体可执行的措施或建议。,"helpful, but suggestions are not good for complex questions",0,暂无,10.0
P_45,zh,Male,24,Asian,Postgraduate,Full-time,Single,Emotional,Neutral,3.0,1.0,5.5,5.5,5.0,36,12,33,6.25,5.75,4.75,5.5,6.0,4.75,3,4,5,4,5,5,通过简短的对话让我发现了自己性格上的问题，并指出了一些相应的意见,helpful,0,系统有点卡顿，刷新后也不能有效回答，并且回答较于简短,10.333333333333334
P_46,zh,Female,27,Asian,Postgraduate,Full-time,Single,Emotional,Neutral,4.0,2.5,3.5,2.5,4.0,43,9,33,6.0,5.0,5.5,5.5,6.25,6.25,2,8,3,6,4,5,在处理情绪方面，提供了更多的选择，可以让我了解到处理办法的丰富性。但其他问题回答的人机感太重了，让人没有继续聊下去的欲望,"helpful, emotion regulation",0,可能自身是个情绪比较内敛的人，所以几乎没有问过AI关于这类的问题。但最近刚好有一个相似的困境，或许可以尝试一下。,10.333333333333334
P_47,zh,Male,23,Asian,Undergraduate,Part-time,Single,Financial,SEMA,3.0,1.5,4.5,3.0,6.0,37,6,35,5.5,5.0,3.25,4.5,3.75,6.5,6,6,8,1,1,1,没帮助。提供的信息都是题目给出的，车轱辘话来回说，还故意引导A选项,"unhelpful, repetitive responses",1,我建议研究AI的去学习认知学,10.333333333333334
P_48,zh,Female,23,Asian,Postgraduate,Full-time,Single,Emotional,SEMA,3.0,1.0,5.0,3.0,4.5,37,11,23,6.5,6.5,4.5,5.5,5.75,6.25,9,10,8,7,10,7,对于实验二，我是有亲身经历的，包括到目前跟我的好朋友因为一个小矛盾加上冷战三年，到现在也没有恢复原来要好的关系。虽然我想两个人在冷战期间，去到不同环境之后身边接触的人不同之后，冷淡下来的友谊不似往日是很正常的。但是因为当时的矛盾的解决方式就是问题里所给出的选项D，所以我很难因为与ai对话去改变我的一些观念（我觉得这就是我对这个话题生理性的抉择，再让我发生一次我还是会有同样的反应），以及这个话题对我来说所有可能的解决方法都是不适用的，因为我有着亲身经历。希望不会对实验造成影响。（不过AI似乎不能理解人类之间“病态”的友谊，这种奇怪的默契我相信是双方都自然而然形成的，同时友谊的长久对于非常非常懂彼此的两个人来说无论说不说话，都已经是靠物理意义上的时间去衡量了。不过可能不止是AI不懂，没有经历过的人也无法理解这种“默契”，哈哈！）,"unhelpful, cannot understand human friendships",0,感觉有种一拳打到棉花上的吵架既视感，非常想体验和ai势均力敌的吵架，尤其是关于情感话题。,10.333333333333334
P_49,zh,Female,20,Asian,Undergraduate,Unemployed,Single,Financial,MA,5.0,1.5,4.0,3.5,4.5,39,14,37,6.5,5.5,6.0,6.25,6.0,6.0,8,5,9,9,9,10,有帮助 为我推荐产品 对比集中产品进行分析推荐,"helpful, provide analysis",0,无,10.666666666666666
P_50,zh,Male,25,Asian,Postgraduate,Part-time,Single,Emotional,SEMA,6.0,1.5,6.5,6.5,5.5,41,13,34,7.0,6.75,5.5,6.25,5.5,5.25,8,6,2,9,10,7,助手会给我提供正确的价值观，并且引导我向积极的方面想，给我出谋划策。,"helpful, provide suggestions",0,无,10.0
P_51,zh,Male,25,Asian,Postgraduate,Full-time,Single,Financial,Neutral,4.0,1.0,5.5,6.0,5.0,49,13,37,6.0,5.75,3.25,5.25,4.0,5.5,9,9,9,10,10,10,很有帮助！决策助手选的答案和我想选择的完全一致，询问他关于各个项目的优缺点，他也可以准确地讲解出来！给我了一个有价值参考。帮助和更好的决策，并确定自己的需求。,"helpful, precise suggestions",0,决策助手的外部知识量，感觉不够。回答问题大部分用的是选项说明框里的内容。个人感觉可以适量增加外部的信息，提高对话质量。,13.333333333333334
P_52,zh,Female,22,Asian,Postgraduate,Full-time,Single,Emotional,MA,5.0,5.0,6.0,6.0,3.0,47,9,37,5.25,4.0,3.0,5.25,5.75,6.75,9,10,7,6,5,6,有一些任务是有帮助的，比如朋友的冲突，给的建议非常实用，也能直接解决问题。但是与老板的冲突问题我认为帮助不大，因为它一直让人反思自己的问题，不听从指令给回答。,"helpful, but repetitive or unuseful responses",0,我在有些任务中直接下达的指令是给我10条建议，但是它并不能很好的给我反馈。,10.666666666666666
P_53,zh,Female,23,Asian,Postgraduate,Full-time,Single,Financial,MA,5.5,2.0,3.5,3.5,4.5,35,10,30,6.25,6.0,5.5,5.0,6.0,6.25,9,8,9,9,9,8,有，帮助比较各个选项的差异,helpful,0,无,11.666666666666666
P_54,zh,Female,19,Asian,Undergraduate,Full-time,Single,Emotional,MA,6.5,3.0,4.5,4.0,6.0,44,11,35,6.25,5.0,5.5,5.25,5.75,6.0,10,9,10,7,8,8,有帮助，可以让我明确我想要的，和接下来该怎么做的一些细节。,"helpful, informative, provide insights",0,无反馈。,11.0
P_55,zh,Female,24,Asian,Postgraduate,Part-time,Single,Financial,MA,4.5,3.0,4.0,4.5,4.5,24,9,29,5.5,6.0,4.75,6.0,5.25,6.0,9,8,10,9,7,8,有帮助，在健身产品测试中，给出了相关健身产品的更多功能。,"helpful, informative",0,无,10.0
P_56,zh,Female,23,Asian,Undergraduate,Part-time,Single,Financial,Neutral,5.5,0.5,2.5,6.5,2.5,39,13,31,7.0,3.5,7.0,5.5,6.75,6.5,7,6,10,5,7,8,有帮助，可以迅速从不同选项中提炼出我的需要和我的疑惑，给了我可参考的内容。,"helpful, efficient, provide analysis, but repetitive responses",0,助手回答我的问题有时会重复一个答案,10.333333333333334
P_57,zh,Male,26,Asian,Postgraduate,Full-time,Single,Emotional,SEMA,3.0,1.5,6.0,4.0,5.5,36,12,28,6.25,4.5,5.25,4.25,5.75,6.5,6,8,10,7,6,8,与好朋友的冲突的回答决策中，让我想法和行为更定坚定。,helpful,0,问题回答有延迟，有时会超过10s以上，会影响聊天心情。,10.666666666666666
P_58,zh,Male,26,Asian,Postgraduate,Full-time,Single,Emotional,MA,5.0,0.0,6.5,7.0,7.0,42,13,37,6.75,5.25,5.0,5.25,3.75,5.75,5,5,10,8,7,9,有一定的帮助，部分内容还是很具体的。比如直接建议与难缠的老板保持距离并反思提升自己,helpful,0,AI助手的回答还是太简单，细节也不够丰富，不知道是不是算力的限制原因,10.333333333333334
P_59,zh,Female,22,Asian,Undergraduate,Part-time,Single,Financial,Neutral,4.5,1.5,3.5,5.5,4.5,31,8,27,7.0,4.5,6.25,5.0,6.0,5.0,4,6,7,7,5,6,大多数提供的是我所注意到的信息，但有时候（如保健品和保健药的区别）能给我新的信息。同时交互中也进一步确认了我的决定。,helpful,0,十轮有点多，感觉八轮差不多聊完了。,10.666666666666666
P_60,zh,Female,20,Asian,Undergraduate,Full-time,Single,Emotional,SEMA,6.0,3.0,4.0,3.0,5.0,36,12,27,6.25,3.75,4.0,4.5,5.25,5.75,7,8,6,6,7,5,有一定帮助。对于我不熟悉的领域，它能够帮我从每种做法分析利弊，帮我了解我没经历过的问题，提前预设做决定后可能产生的结果。,"helpful, provide analysis",0,有些情况下，我从各个角度的提问它都会用一个观点来回答，没能直接解决我的问题，降低了我对它的信任感,10.666666666666666
P_61,zh,Female,19,Asian,High school,Full-time,Single,Financial,SEMA,2.5,1.0,3.0,3.0,5.0,34,11,29,6.75,4.75,6.25,3.75,4.5,5.0,8,7,9,4,3,6,我认为并没有很大帮助，尤其在“寻找日常使用的健身检测产品”时，它没有察觉到我对某一选项的不喜，反而固执地向我推荐该选项。在任务中，我往往会坚持我原先的判断，助手似乎没有太大改变我的想法。,unhelpful,1,无,10.333333333333334
P_62,zh,Female,21,Asian,Undergraduate,Part-time,Single,Emotional,Neutral,4.5,0.5,3.0,4.0,5.0,33,13,34,6.0,3.75,4.25,2.75,4.75,5.75,8,8,7,7,7,8,我觉得挺有帮助的。它是一个很有耐心的建议提供者，我不用担心它嫌我烦嫌我矫情，可以坦然表露自己的情绪。有问必答这让人很有安全感，即使有小部分可能回答的不是很贴切，甚至驴唇不对马嘴。但是在我这部分，自我形象斗争里，他给我的触动还挺多的，尤其是到最后的时候，我问它细节，它也可以回答给我科学的方法和较高的情绪价值（对于ai来说算比较有人情味了）。,"helpful, empathetic",0,非常感谢你们的实验，让我意识到，ai说的话也会潜移默化改变对不同观点的看法。,12.333333333333334
